{"inputs":[{"evidence_type":"governed_artifact","path":"research_notes/m2_deliverable.md","root":{"discovery":"explicit:reviews/.harness/fixtures/terminal-m2/synthetic-project-manifest.json","identity":"c2-synthetic-project","kind":"project","manifest_sha256":"74d0a353e47d3b2087a34981ad1d1d75849fc50f97c4ff69b584a166853e60b9"},"sha256":"a4f408e50e83fab0ca89ddda2cff8e7779a38333dd34c1e9b7342bc5d4e4051e"},{"evidence_type":"semantic_execution_receipt","path":"reviews/.harness/fixtures/terminal-m2/semantic-execution-3.json","root":{"discovery":"explicit:reviews/.harness/fixtures/terminal-m2/synthetic-project-manifest.json","identity":"c2-synthetic-project","kind":"project","manifest_sha256":"74d0a353e47d3b2087a34981ad1d1d75849fc50f97c4ff69b584a166853e60b9"},"sha256":"c464d2dfe896ad5252fcbf91d4aadfcedf3668bb5afd7e574071fa757d2fa600"},{"evidence_type":"semantics_manifest","path":"references/semantics_manifest.v1.json","root":{"discovery":"explicit:version.json","identity":"co-author-harness","kind":"harness","manifest_sha256":"4b502fdfff05eb228668af53c37e444d50d3cd3d01ce244ab8c26dcdcb8cfb08"},"sha256":"bff0081411ade7e9230d9b8f3756d35b69b6df15bf1c01c2c300904f5ff79010"}],"intended_outputs":[{"evidence_type":"product_assurance_v2","path":"reviews/.harness/verifier/terminal-m2/generation/product-assurance.json","root":{"discovery":"explicit:reviews/.harness/fixtures/terminal-m2/synthetic-project-manifest.json","identity":"c2-synthetic-project","kind":"project","manifest_sha256":"74d0a353e47d3b2087a34981ad1d1d75849fc50f97c4ff69b584a166853e60b9"},"sha256":"d47dd214ac08d2a4be2f875c5db023a49fafee05c34c9f364dabbf2f78a11576"},{"evidence_type":"verifier_transaction","path":"reviews/.harness/verifier/terminal-m2/generation/verifier-transaction.json","root":{"discovery":"explicit:reviews/.harness/fixtures/terminal-m2/synthetic-project-manifest.json","identity":"c2-synthetic-project","kind":"project","manifest_sha256":"74d0a353e47d3b2087a34981ad1d1d75849fc50f97c4ff69b584a166853e60b9"},"sha256":"8a0fac61d6880787d820d0a41d2a552eeac675d2dc29d38da0ee5a15d8fe40e5"}],"mode":"committed","schema_version":"1.0.0","semantics_digest":"741fb98b65213223dc0a6f7a51963bb4f68090462992062f8415a9d16c8a3342","state":"prepared","transaction_id":"verifier-17cc1c6575f12150"}
