{"inputs":[{"evidence_type":"governed_artifact","path":"research_notes/m3_deliverable.md","root":{"discovery":"explicit:reviews/.harness/fixtures/terminal-m3/synthetic-project-manifest.json","identity":"c2-synthetic-project","kind":"project","manifest_sha256":"d01c561c76a1ea977076c19491de3f4654053c58b3f3e6161b8701f09fc22966"},"sha256":"1121ef42a8339a21f0b443ce1689beb5f7eacc960b4a2186b97a9c6afbb13fb9"},{"evidence_type":"semantic_execution_receipt","path":"reviews/.harness/verifier/terminal-m3/evaluation-semantic.json","root":{"discovery":"explicit:reviews/.harness/fixtures/terminal-m3/synthetic-project-manifest.json","identity":"c2-synthetic-project","kind":"project","manifest_sha256":"d01c561c76a1ea977076c19491de3f4654053c58b3f3e6161b8701f09fc22966"},"sha256":"549f066fb11df9e5a0ca54a94bcd2368e34e0fc90607c408f5f5e649ea2e6a35"},{"evidence_type":"semantics_manifest","path":"references/semantics_manifest.v1.json","root":{"discovery":"explicit:version.json","identity":"co-author-harness","kind":"harness","manifest_sha256":"4b502fdfff05eb228668af53c37e444d50d3cd3d01ce244ab8c26dcdcb8cfb08"},"sha256":"bff0081411ade7e9230d9b8f3756d35b69b6df15bf1c01c2c300904f5ff79010"}],"intended_outputs":[{"evidence_type":"product_assurance_v2","path":"reviews/.harness/verifier/terminal-m3/evaluation-product/product-assurance.json","root":{"discovery":"explicit:reviews/.harness/fixtures/terminal-m3/synthetic-project-manifest.json","identity":"c2-synthetic-project","kind":"project","manifest_sha256":"d01c561c76a1ea977076c19491de3f4654053c58b3f3e6161b8701f09fc22966"},"sha256":"6b1d8e092a470a383d34ba3d8e452610ce8ce91efa8df8aff3c973db99d34530"},{"evidence_type":"verifier_transaction","path":"reviews/.harness/verifier/terminal-m3/evaluation-product/verifier-transaction.json","root":{"discovery":"explicit:reviews/.harness/fixtures/terminal-m3/synthetic-project-manifest.json","identity":"c2-synthetic-project","kind":"project","manifest_sha256":"d01c561c76a1ea977076c19491de3f4654053c58b3f3e6161b8701f09fc22966"},"sha256":"a1ee28fe3eb645ed881bf2391ae1dc4cea04145e3f9b445e0f8778783cf2a062"}],"mode":"committed","schema_version":"1.0.0","semantics_digest":"741fb98b65213223dc0a6f7a51963bb4f68090462992062f8415a9d16c8a3342","state":"prepared","transaction_id":"verifier-56b27b9a5ce5e0d8"}
