{"inputs":[{"evidence_type":"governed_artifact","path":"milestones/M2_annotated_references.md","root":{"discovery":"explicit:reviews/.harness/fixtures/m2-initial/synthetic-project-manifest.json","identity":"c2-synthetic-project","kind":"project","manifest_sha256":"edada29a91002a6d597c4ae19300f2fbb59e5f77b22882eebc4f4d43dcf3cb34"},"sha256":"9a37c5f81f60367abf798f64e37babf1db948b88e6703fb9c9a156b60031b062"},{"evidence_type":"semantic_execution_receipt","path":"reviews/.harness/verifier/m2-initial/evaluation-semantic.json","root":{"discovery":"explicit:reviews/.harness/fixtures/m2-initial/synthetic-project-manifest.json","identity":"c2-synthetic-project","kind":"project","manifest_sha256":"edada29a91002a6d597c4ae19300f2fbb59e5f77b22882eebc4f4d43dcf3cb34"},"sha256":"1d581517d1367df1fb615a6fa3ee3d6bc46dfc817aef32c5e9d935c05cab286f"},{"evidence_type":"semantics_manifest","path":"references/semantics_manifest.v1.json","root":{"discovery":"explicit:version.json","identity":"co-author-harness","kind":"harness","manifest_sha256":"4b502fdfff05eb228668af53c37e444d50d3cd3d01ce244ab8c26dcdcb8cfb08"},"sha256":"bff0081411ade7e9230d9b8f3756d35b69b6df15bf1c01c2c300904f5ff79010"}],"intended_outputs":[{"evidence_type":"product_assurance_v2","path":"reviews/.harness/verifier/m2-initial/evaluation-product/product-assurance.json","root":{"discovery":"explicit:reviews/.harness/fixtures/m2-initial/synthetic-project-manifest.json","identity":"c2-synthetic-project","kind":"project","manifest_sha256":"edada29a91002a6d597c4ae19300f2fbb59e5f77b22882eebc4f4d43dcf3cb34"},"sha256":"304360813daecaf29a034eb16f84072b0d37bd7029578b7d82460b75fcd64033"},{"evidence_type":"verifier_transaction","path":"reviews/.harness/verifier/m2-initial/evaluation-product/verifier-transaction.json","root":{"discovery":"explicit:reviews/.harness/fixtures/m2-initial/synthetic-project-manifest.json","identity":"c2-synthetic-project","kind":"project","manifest_sha256":"edada29a91002a6d597c4ae19300f2fbb59e5f77b22882eebc4f4d43dcf3cb34"},"sha256":"217961c41dbf586c248a86f1c4e50e80a7490f8d61e22509aa65e80a6a42af48"}],"mode":"committed","schema_version":"1.0.0","semantics_digest":"741fb98b65213223dc0a6f7a51963bb4f68090462992062f8415a9d16c8a3342","state":"prepared","transaction_id":"verifier-9156e833bd7822e0"}
