{"inputs":[{"evidence_type":"governed_artifact","path":"research_notes/m1_deliverable.md","root":{"discovery":"explicit:reviews/.harness/fixtures/terminal-m1/synthetic-project-manifest.json","identity":"c2-synthetic-project","kind":"project","manifest_sha256":"c4b8d95709994f81093641c7a4739267e8539b7d20a9d6dcb45552433c7104f6"},"sha256":"f4e3d2abcf25005b47967306a2608c01779bb010670c6f666e2fa10088735763"},{"evidence_type":"semantic_execution_receipt","path":"reviews/.harness/fixtures/terminal-m1/semantic-execution-3.json","root":{"discovery":"explicit:reviews/.harness/fixtures/terminal-m1/synthetic-project-manifest.json","identity":"c2-synthetic-project","kind":"project","manifest_sha256":"c4b8d95709994f81093641c7a4739267e8539b7d20a9d6dcb45552433c7104f6"},"sha256":"6bb12d0b49f2b2c3bc2a5e756133bed73be35b434d2549ac3357b3f69bf75086"},{"evidence_type":"semantics_manifest","path":"references/semantics_manifest.v1.json","root":{"discovery":"explicit:version.json","identity":"co-author-harness","kind":"harness","manifest_sha256":"4b502fdfff05eb228668af53c37e444d50d3cd3d01ce244ab8c26dcdcb8cfb08"},"sha256":"bff0081411ade7e9230d9b8f3756d35b69b6df15bf1c01c2c300904f5ff79010"}],"intended_outputs":[{"evidence_type":"product_assurance_v2","path":"reviews/.harness/verifier/terminal-m1/generation/product-assurance.json","root":{"discovery":"explicit:reviews/.harness/fixtures/terminal-m1/synthetic-project-manifest.json","identity":"c2-synthetic-project","kind":"project","manifest_sha256":"c4b8d95709994f81093641c7a4739267e8539b7d20a9d6dcb45552433c7104f6"},"sha256":"8b7e3d30dd64a47eab933e89d73f9ecb75002715ae5b954052c81ea5e79ce5de"},{"evidence_type":"verifier_transaction","path":"reviews/.harness/verifier/terminal-m1/generation/verifier-transaction.json","root":{"discovery":"explicit:reviews/.harness/fixtures/terminal-m1/synthetic-project-manifest.json","identity":"c2-synthetic-project","kind":"project","manifest_sha256":"c4b8d95709994f81093641c7a4739267e8539b7d20a9d6dcb45552433c7104f6"},"sha256":"e9173cd12e60e8b38c998da88398fe8aa607a1ebd95ae04c163cdf97bb619bc4"}],"mode":"committed","schema_version":"1.0.0","semantics_digest":"741fb98b65213223dc0a6f7a51963bb4f68090462992062f8415a9d16c8a3342","state":"prepared","transaction_id":"verifier-52f503bbc454ca9f"}
